{
  "id": "3f8a1c92-5b47-4d1e-9a06-7c2b8e4f0d13",
  "owner": {
    "type": "User",
    "id": "11111111-1111-4111-8111-111111111111"
  },
  "processor": "stripe",
  "processor_customer_id": null,
  "email": "kaka@example.com",
  "metadata": {},
  "created_at": "2026-09-30T04:00:00Z",
  "updated_at": "2026-09-30T04:00:00Z"
}